{
  "$schema": "../schema/palette.schema.json",
  "name": "glimmerfall-master",
  "version": "0.1-draft",
  "status": "черновик G2.1 — ждёт утверждения владельцем; цвета подобраны в OKLCH (tools/sprites), проверки — tools/sprites/tests/test_palette.py",
  "colors": {
    "ink": "#07040c",
    "gloom1": "#100c1d",
    "gloom2": "#18162c",
    "gloom3": "#21233b",
    "stone1": "#18191f",
    "stone2": "#23262e",
    "stone3": "#2e353d",
    "stone4": "#3c454d",
    "earth1": "#23120d",
    "earth2": "#362015",
    "earth3": "#4a321f",
    "moss1": "#142718",
    "moss2": "#2c3b20",
    "crimson1": "#3d0e1b",
    "crimson2": "#661423",
    "crimson3": "#95282a",
    "crimson4": "#bf4f36",
    "indigo1": "#303664",
    "indigo2": "#3f558d",
    "indigo3": "#567caf",
    "skin1": "#57362f",
    "skin2": "#885846",
    "skin3": "#b48360",
    "skin4": "#d5b089",
    "brass1": "#7e5823",
    "brass2": "#ad8a35",
    "brass3": "#dbc775",
    "steel1": "#505963",
    "steel2": "#7f8b94",
    "steel3": "#c5d0d5",
    "bone1": "#53483b",
    "bone2": "#7f735e",
    "bone3": "#aea48a",
    "bone4": "#ddd8c0",
    "rot1": "#495539",
    "rot2": "#747852",
    "rot3": "#9e9b71",
    "fire1": "#a8260f",
    "fire2": "#d75b00",
    "fire3": "#f99000",
    "fire4": "#ffcc5f",
    "fire5": "#fff5bb",
    "lightning1": "#6b30af",
    "lightning2": "#946ade",
    "lightning3": "#c3b0fd",
    "lightning4": "#eeecff",
    "frost1": "#26679e",
    "frost2": "#2f9ecf",
    "frost3": "#7bd3e9",
    "frost4": "#d1f7fc",
    "poison1": "#227d32",
    "poison2": "#51aa3c",
    "poison3": "#91d54e",
    "poison4": "#daf599",
    "radiance1": "#deb042",
    "radiance2": "#f3de90",
    "radiance3": "#fdfadb",
    "telegraph1": "#c7127f",
    "telegraph2": "#f95da2",
    "white": "#ffffff"
  },
  "ramps": {
    "gloom": {"use": "world", "tones": ["ink", "gloom1", "gloom2", "gloom3"], "note": "Тьма: фон, края пятна света, самые глубокие тени"},
    "stone": {"use": "world", "tones": ["stone1", "stone2", "stone3", "stone4"], "note": "камень, кладка, плиты пола; холодный сдвиг к свету"},
    "earth": {"use": "world", "tones": ["earth1", "earth2", "earth3"], "note": "земля, дерево, гниющие балки"},
    "moss": {"use": "world", "tones": ["moss1", "moss2"], "note": "мох и сырость — акцент акта"},
    "crimson": {"use": "material", "tones": ["crimson1", "crimson2", "crimson3", "crimson4"], "note": "ткань героев (плащи, капюшоны)"},
    "indigo": {"use": "material", "tones": ["gloom3", "indigo1", "indigo2", "indigo3"], "note": "вторая ткань: стёганка, плащи союзников"},
    "skin": {"use": "material", "tones": ["skin1", "skin2", "skin3", "skin4"], "note": "кожа"},
    "brass": {"use": "material", "tones": ["earth3", "brass1", "brass2", "brass3"], "note": "латунь фонарей и UI"},
    "steel": {"use": "material", "tones": ["stone3", "steel1", "steel2", "steel3"], "note": "сталь клинков и доспехов"},
    "bone": {"use": "material", "tones": ["bone1", "bone2", "bone3", "bone4"], "note": "кость, воск, пергамент"},
    "rot": {"use": "material", "tones": ["moss2", "rot1", "rot2", "rot3"], "note": "плоть порождений Тьмы"},
    "oldbone": {"use": "material", "tones": ["earth3", "bone1", "bone2", "bone3"], "note": "старая кость нежити и рога демонов: темнее воска, светлое оставлено героям"},
    "blackiron": {"use": "material", "tones": ["gloom2", "stone3", "steel1", "steel2"], "note": "тёмное железо: доспех демонов и босса, оружие, оковы"},
    "darkred": {"use": "material", "tones": ["crimson1", "crimson2", "crimson3"], "note": "кровавая ткань и кожа демонов без яркого блика: мрачнее, чем crimson"},
    "darkcloth": {"use": "material", "tones": ["gloom2", "gloom3", "indigo1", "indigo2"], "note": "чёрно-синяя ткань: мантии, капюшоны"},
    "leather": {"use": "material", "tones": ["earth1", "earth2", "earth3", "bone1"], "note": "кожа ремней, сапог и колчанов, тёмное дерево"},
    "fur": {"use": "material", "tones": ["earth2", "earth3", "bone1", "bone2"], "note": "бурый мех: мантии, загривки"},
    "darkrot": {"use": "material", "tones": ["moss1", "moss2", "rot1", "rot2"], "note": "гнилая плоть гулей без светлого блика"},
    "fire": {"use": "vfx", "tones": ["fire1", "fire2", "fire3", "fire4", "fire5"], "note": "огонь: красный → оранжевый → янтарь → белый жар"},
    "lightning": {"use": "vfx", "tones": ["lightning1", "lightning2", "lightning3", "lightning4"], "note": "молния: фиолетовый → белый"},
    "frost": {"use": "vfx", "tones": ["frost1", "frost2", "frost3", "frost4"], "note": "мороз: синий → циан → белый"},
    "poison": {"use": "vfx", "tones": ["poison1", "poison2", "poison3", "poison4"], "note": "яд: зелёный → кислотно-салатовый"},
    "radiance": {"use": "vfx", "tones": ["brass2", "radiance1", "radiance2", "radiance3"], "note": "сияние фонаря: золото → белый"},
    "telegraph": {"use": "telegraph", "tones": ["telegraph1", "telegraph2"], "note": "ТОЛЬКО вражеские телеграфы; в эффектах игрока запрещён"}
  },
  "roles": {
    "outline": "ink",
    "flash": "white"
  },
  "lightness": {
    "world": [0.10, 0.40],
    "material": [0.20, 0.90],
    "vfx": [0.45, 1.00],
    "telegraph": [0.50, 0.75]
  }
}
